report_name,description
Karyawan fungsi CDC Regional dan Witel,Data Karyawan CDC Corporate dan Karyawan di Regional / Witel yang menjalankan Fungsi CDC
Attrition Rate or Turnover Rate,Metrics data Turnover Rate karyawan Telkom parent sejak 2020-02-01
Data NCX Product Digital - 7 product priority (age),Data Laporan NCX
OKR Telkom Corporete University,OKR Karyawan TCU dari periode Januari 2025
Data FPFM - Employee Relation,Data karyawan aktif Telkom Parent yang berusia kurang dari sama dengan 35 tahun untuk kebutuhan FPFM HC Employee Relation
